{
  "contract_version": "analyst-workflow-method.v1",
  "method_id": "three-statement-analyst-method",
  "version": "1.0.0",
  "family_id": "three_statement",
  "title": "Integrated three-statement analyst method",
  "objective": "Turn historical statements and explicit operating assumptions into linked projected income statement, balance sheet and cash-flow statements with supporting schedules and integrity checks.",
  "steps": [
    {"step_id":"define-model-purpose","sequence":1,"stage":"scope_decision","purpose":"Define the decision, forecast horizon and required statement outputs.","execution_class":"judgment","requirement_class":"universal","inputs":[],"outputs":["model_scope"],"checks":["purpose_and_horizon_explicit"],"conditions":[],"source_references":["gridlines-essential-financial-modelling","simple-model-three-statement"]},
    {"step_id":"load-historical-statements","sequence":2,"stage":"source_history","purpose":"Load historical income statement, balance sheet and cash-flow data with opening balances and relevant supporting data.","execution_class":"source","requirement_class":"universal","inputs":["income_statement_history","balance_sheet_history","cash_flow_history"],"outputs":["statement_history"],"checks":["required_periods_present"],"conditions":[],"source_references":["simple-model-three-statement","cfi-fpa-excel-modelling"]},
    {"step_id":"normalize-and-reconcile-statements","sequence":3,"stage":"normalize_reconcile","purpose":"Normalize and reconcile historical statements before projecting them.","execution_class":"deterministic","requirement_class":"universal","inputs":["statement_history"],"outputs":["reconciled_statement_history"],"checks":["balance_sheet_balances","cash_flow_reconciles"],"conditions":[],"source_references":["fast-standard-02c","icaew-financial-modelling-code"]},
    {"step_id":"set-operating-assumptions","sequence":4,"stage":"assumptions_drivers","purpose":"Set explicit assumptions for revenue, costs, working capital, capex, financing, tax and other material drivers.","execution_class":"judgment","requirement_class":"universal","inputs":["reconciled_statement_history"],"outputs":["statement_assumptions"],"checks":["assumptions_explicit"],"conditions":[],"source_references":["gridlines-essential-financial-modelling","kenji-three-statement-video"]},
    {"step_id":"establish-time-and-link-structure","sequence":5,"stage":"model_structure","purpose":"Create a consistent projection time axis and linkage structure for statements and schedules.","execution_class":"governed_rule","requirement_class":"universal","inputs":["model_scope"],"outputs":["projection_structure"],"checks":["time_axis_consistent"],"conditions":[],"source_references":["fast-standard-02c","gridlines-essential-financial-modelling"]},
    {"step_id":"build-supporting-schedules","sequence":6,"stage":"supporting_schedules","purpose":"Build the material schedules required by the statements, including fixed assets, working capital and debt where applicable.","execution_class":"deterministic","requirement_class":"universal","inputs":["projection_structure","statement_assumptions","reconciled_statement_history"],"outputs":["supporting_schedules"],"checks":["schedule_roll_forwards_consistent"],"conditions":[],"source_references":["simple-model-three-statement","gridlines-essential-financial-modelling","kenji-three-statement-video"]},
    {"step_id":"project-and-link-statements","sequence":7,"stage":"core_model","purpose":"Project the statements and link earnings, non-cash items, working capital, financing and cash movements consistently.","execution_class":"deterministic","requirement_class":"universal","inputs":["supporting_schedules","statement_assumptions"],"outputs":["three_statement_forecast"],"checks":["statements_linked"],"conditions":[],"source_references":["simple-model-three-statement","gridlines-three-statement","kenji-three-statement-video"]},
    {"step_id":"validate-integrity","sequence":8,"stage":"validation","purpose":"Require the balance sheet, cash flow and schedule roll-forwards to reconcile and expose model errors before use.","execution_class":"deterministic","requirement_class":"universal","inputs":["three_statement_forecast","supporting_schedules"],"outputs":["validated_three_statement_forecast"],"checks":["balance_sheet_balances","cash_reconciles","roll_forwards_reconcile"],"conditions":[],"source_references":["fast-standard-02c","icaew-financial-modelling-code","gridlines-essential-financial-modelling"]},
    {"step_id":"run-scenarios","sequence":9,"stage":"scenario_sensitivity","purpose":"Apply explicit alternative assumptions and recompute the linked statements.","execution_class":"deterministic","requirement_class":"common_default","inputs":["validated_three_statement_forecast","statement_assumptions"],"outputs":["three_statement_scenarios"],"checks":["base_case_preserved"],"conditions":[],"source_references":["fast-standard-02c","gridlines-essential-financial-modelling"]},
    {"step_id":"prepare-integrated-outputs","sequence":10,"stage":"outputs_kpis","purpose":"Expose linked profit, cash, balance-sheet, liquidity and selected KPI outputs needed by downstream decisions.","execution_class":"deterministic","requirement_class":"universal","inputs":["validated_three_statement_forecast","three_statement_scenarios"],"outputs":["integrated_outputs"],"checks":["outputs_trace_to_statements"],"conditions":[],"source_references":["cfi-fpa-excel-modelling","simple-model-three-statement"]},
    {"step_id":"prepare-commentary-evidence","sequence":11,"stage":"commentary_evidence","purpose":"Produce traceable changes in earnings, cash and balance-sheet positions with their explicit assumption or schedule drivers.","execution_class":"governed_rule","requirement_class":"common_default","inputs":["integrated_outputs"],"outputs":["commentary_evidence"],"checks":["evidence_traceable","assumption_effects_identified"],"conditions":[],"source_references":["icaew-financial-modelling-code","cfi-fpa-excel-modelling"]}
  ],
  "source_references": ["fast-standard-02c","icaew-financial-modelling-code","gridlines-essential-financial-modelling","gridlines-three-statement","simple-model-three-statement","cfi-fpa-excel-modelling","kenji-three-statement-video"],
  "review_state": "reference_grounded"
}
